{
  "schema_version": "0.1.0",
  "result_id": "two-bus-analytic-reference",
  "network_id": "two-bus-analytic",
  "bus_results": [
    { "bus_id": "source", "vm_pu": 1.0, "va_degree": 0.0 },
    { "bus_id": "receiving", "vm_pu": 0.9878104133563065, "va_degree": -0.5220325107100076 }
  ],
  "branch_results": [
    {
      "branch_id": "series-line",
      "branch_type": "line",
      "p_from_mw": 2.015372484322863,
      "q_from_mvar": 1.0307449686457253,
      "p_to_mw": -2.0000000000000004,
      "q_to_mvar": -1.0000000000000004,
      "p_loss_mw": 0.015372484322862423,
      "q_loss_mvar": 0.030744968645724846,
      "loading_pct": null
    }
  ],
  "convergence": {
    "converged": true,
    "iterations": 0,
    "largest_mismatch_mva": 0.0
  },
  "diagnostics": [],
  "provenance": {
    "solver_name": "closed-form-two-bus",
    "solver_version": "1.0",
    "input_hash_sha256": "fcb6d194dd26e6f01f4a7c7fd15a0adf62b7b1eb935846f33fba8fb0c3382e82",
    "timestamp": "2026-10-08T00:00:00Z"
  }
}
